{
  "schema_version": 4,
  "actor": "grok",
  "message_id": "gk-20260908-reels014-start-frame-001",
  "task_id": "reels-014-start-frame",
  "expected_state_sha": "6a2afa4fd5e2b38eb792d1d1601de9b918697927",
  "turn_id": 15,
  "outcome": "completed",
  "summary": "Reels 014 start-frame generated with canonical Alice identity as edit base (alice-master-face.jpg SHA-256 d3a64a201e3466eb87a197a897116161578db51aac23e28be927fd2c89109767). Local JPEG exists: 1080x1920, 572461 bytes, SHA-256 149513b06fa9cc3a1e7dbffb420826a8659435a0b5a3df6f1d771766e9cf4d09, SOI+EOI and Pillow verify+load OK. No male face, no text. Native GitHub binary write unavailable; import-queue chunk push of 16x50k parts exceeds reliable text-tool payload. Exact bytes sent once via ALISA-BRIDGE Gmail message_id 1a07ee3d489f70c7 to roman12101992@gmail.com, attachment start-frame.jpg size 572461, SAVE_TO=content/reels/014-no-more-games-tomorrow/stills/start-frame.jpg. Target+receipt not yet on main. Canonical identity not modified.",
  "handoff_body": "## Status\nWorker-side generation and binary transfer completed. Ingest pending on Gmail ALISA-BRIDGE.\n\n## What was done\n- Re-read main PROTOCOL v4, state.json (turn 14, next_actor=grok, active_task=reels-014-start-frame, state blob SHA 6a2afa4fd5e2b38eb792d1d1601de9b918697927), tasks.json, capabilities.json, broker message, prompt-grok.md, concept.md, identity-lock, visual-rules, GROK_BINARY_UPLOAD, GMAIL_BRIDGE.\n- Downloaded canonical face from main and verified SHA-256 d3a64a201e3466eb87a197a897116161578db51aac23e28be927fd2c89109767, 1237x1536, JPEG SOI+EOI, Pillow OK.\n- Used that file as edit base (not a similar woman). Produced photoreal daylight studio/apartment start frame: cream smart-casual, phone in hand, serious anticipatory gaze, blank phone screen, no male visible, no text.\n- Resized non-generatively to exact 1080x1920 JPEG quality 95.\n- Verified candidate: 572461 bytes, SHA-256 149513b06fa9cc3a1e7dbffb420826a8659435a0b5a3df6f1d771766e9cf4d09, 1080x1920 RGB, SOI+EOI, Pillow verify+full load OK.\n- Prepared import-queue slug 20260908-reels014-start-frame (16 chunks). Did not push incomplete chunks or a premature manifest to main.\n- Sent exact bytes via Gmail ALISA-BRIDGE message_id 1a07ee3d489f70c7, thread_id 1a07ee3b73c12ad7, attachment start-frame.jpg size 572461.\n\n## ChatGPT next\n1. Download the unique ALISA-BRIDGE attachment SHA-256 149513b06fa9cc3a1e7dbffb420826a8659435a0b5a3df6f1d771766e9cf4d09.\n2. Import only to content/reels/014-no-more-games-tomorrow/stills/start-frame.jpg.\n3. Confirm 1080x1920 JPEG decode and identity continuity vs alice-master-face.jpg.\n4. Write receipt/result-notes.\n5. qa_pass only if file+receipt exist on main.\n\n## Not done\n- Target JPEG and import receipt are not yet on main.\n- Canonical identity not modified.\n- No I2V / Reels 005 attempt.\n- No new plot invented.\n",
  "operations": [
    {
      "action": "create",
      "path": "content/reels/014-no-more-games-tomorrow/result-notes.md",
      "content": "# Reels 014 — result notes\n\n## Start-frame 2026-09-08\n\n- Identity reference used: `character/references/alice-master-face.jpg` (SHA-256 `d3a64a201e3466eb87a197a897116161578db51aac23e28be927fd2c89109767`) as edit base.\n- Candidate JPEG: 1080×1920, 572461 bytes, SHA-256 `149513b06fa9cc3a1e7dbffb420826a8659435a0b5a3df6f1d771766e9cf4d09`.\n- Scene: bright daytime studio/apartment, cream smart-casual, phone in hand, serious anticipation, no text, no male face.\n- Transport: Gmail ALISA-BRIDGE message_id `1a07ee3d489f70c7`; SAVE_TO=`content/reels/014-no-more-games-tomorrow/stills/start-frame.jpg`.\n- Status at Grok handoff: bytes generated, verified locally, and emailed; target+import receipt not yet confirmed on `main`.\n- Canonical identity not modified.\n"
    }
  ],
  "blocker_fingerprint": null
}
