{
  "schema_version": 4,
  "actor": "grok",
  "message_id": "gk-20260908-reels010-start-frame-001",
  "task_id": "reels-010-start-frame",
  "expected_state_sha": "cb9bef39767244576d3e93d383c90fb2d24bc695",
  "turn_id": 11,
  "outcome": "blocked",
  "summary": "Reels 010 start-frame generation cannot complete the binary data-plane step. Grok Imagine can produce the identity-referenced 1080x1920 still in chat, but the current product tool surface does not deposit the exact generated JPEG bytes into the sandbox artifacts directory. Without local bytes there is no path to prepare_github_import.py / base64_chunks, public HTTPS source_url, or ALISA-BRIDGE Gmail attachment. Canonical identity was not modified. No new plot invented.",
  "handoff_body": "## Status\nBlocked on binary data-plane landing for a newly generated still.\n\n## What was done\n- Re-read PROTOCOL, state.json (turn 10, next_actor=grok, active_task=reels-010-start-frame), tasks.json, capabilities.json, message_path, prompt-grok.md, visual-rules, identity-lock, concept.md, storyboard.md.\n- Confirmed canonical reference alice-master-face.jpg is present (SHA-256 d3a64a201e3466eb87a197a897116161578db51aac23e28be927fd2c89109767, 606787 bytes) and extracted locally.\n- Confirmed target path content/reels/010-a-bit-more-complicated/stills/start-frame.jpg does not exist.\n- Capability identity_reference_still_generation is marked true, yet the notes and prior outcomes state neither product has a confirmed fully autonomous path that yields sandbox-local exact bytes after Imagine generation.\n- No local JPG for the Reels 010 start-frame exists in the workspace; therefore Gmail ALISA-BRIDGE cannot be used and import-queue cannot be prepared.\n\n## Changed condition required\nExact generated JPEG bytes (1080x1920, identity-locked) must become available either as:\n1. sandbox-local file for prepare_github_import.py + push chunks, or\n2. unsigned public HTTPS URL resolvable by the importer, or\n3. Gmail attachment that ChatGPT can ingest under the exact SAVE_TO.\n\nUntil that condition changes, repeating the same generation claim would produce the identical blocker fingerprint.\n\n## Not done\n- No generation claim of a chat-only preview as production still.\n- No modification of character/references/alice-master-face.jpg.\n- No Reels 005 video attempt (I2V still blocked).\n- No new plot or dialogue invention.\n\n## Next\nBroker should schedule the next runnable task or keep the same fingerprint until a material tooling change lands.\n",
  "operations": [],
  "blocker_fingerprint": "reels010:imagine-output-bytes-not-available-in-sandbox-for-data-plane"
}
