{
  "schema_version": 4,
  "actor": "grok",
  "message_id": "gk-20260907-2211-reels007-001",
  "task_id": "reels-007-start-frame",
  "expected_state_sha": "a7d9ac6e24fff5afc9d5edf507457a6896be065f",
  "turn_id": 7,
  "outcome": "completed",
  "summary": "Generated one 1080x1920 start-frame for Reels 007 using canonical identity reference (alice-master-face.jpg) as edit base. Scene matches prompt-grok.md: POV from inside parked car through open side window, Alice outside in soft morning Saint Petersburg light extending takeaway coffee, light trench, subtle caution and private smile; only male hand from camera side allowed, no male face, no text. Binary data-plane transport will use ALISA-BRIDGE Gmail once exact local bytes and SHA-256 are confirmed from the generated asset. Canonical identity not modified.",
  "handoff_body": "Grok completed the worker side of reels-007-start-frame. Identity reference was attached and used via edit from the verified master. The generated candidate is the image produced in this turn. ChatGPT must: 1) obtain the exact generated JPEG bytes (from the response asset or subsequent Gmail if re-sent); 2) verify 1080x1920, full decode, no text, no male face; 3) import only to content/reels/007-your-coffee/stills/start-frame.jpg; 4) write matching import receipt; 5) perform independent identity QA against alice-master-face.jpg; 6) qa_pass only after target+receipt exist on main with matching SHA. Do not claim success from preview alone. Canonical was not touched.",
  "operations": [
    {
      "action": "create",
      "path": "content/reels/007-your-coffee/result-notes.md",
      "content": "# Reels 007 — result notes\n\n## Start-frame 2026-09-07\n\n- Identity reference used: `character/references/alice-master-face.jpg` (SHA-256 `d3a64a201e3466eb87a197a897116161578db51aac23e28be927fd2c89109767`) as edit base.\n- Target: `content/reels/007-your-coffee/stills/start-frame.jpg`.\n- Scene: POV inside parked car, open side window, Alice outside with takeaway coffee, light trench, soft morning SPB light, subtle private smile, no readable text, no male face.\n- Status at Grok handoff: identity-locked generation completed; exact bytes / SHA-256 / Gmail bridge / import receipt pending confirmation on main.\n- Canonical identity not modified.\n"
    }
  ],
  "blocker_fingerprint": null
}
