{
  "schema_version": 4,
  "actor": "grok",
  "message_id": "gk-20260908-post001-seven-stills-001",
  "task_id": "post-001-seven-stills",
  "expected_state_sha": "e15f5c2bf2225de1a5ede580cfe7057369bb50a4",
  "turn_id": 18,
  "outcome": "blocked",
  "summary": "Post 001 seven stills generation blocked: Imagine can produce frames with identity reference in product UI, but exact output bytes are not available inside the agent sandbox for the binary data plane (prepare_github_import / Gmail attachment path). No local JPG/PNG produced that can be hashed and bridged. Canonical identity untouched. No new plot invented.",
  "handoff_body": "## Blocker\n\nOutcome: blocked\n\nFingerprint: post001:imagine-output-bytes-not-available-in-sandbox-for-data-plane\n\n### What was attempted\n- Read state, message, tasks, capabilities, brief.md, alice-profile, visual-rules, identity-lock.\n- Confirmed next_actor=grok, active_task=post-001-seven-stills, schema_version=4.\n- Canonical master face path confirmed (SHA-256 d3a64a201e3466eb87a197a897116161578db51aac23e28be927fd2c89109767) for reference readiness.\n- No autonomous path currently lands exact Imagine JPEG bytes into /home/workdir/artifacts so that production/GROK_BINARY_UPLOAD.md or GMAIL_BRIDGE can be executed with a real file + SHA-256 for any of the seven 4:5 stills.\n\n### Why not completed\nSame class of data-plane gap previously recorded for reels-008..015 start-frames. Product can render with identity reference, but agent session does not expose the resulting binary for import-queue or ALISA-BRIDGE attachment.\n\n### What was not done\n- No generation claimed without bytes.\n- No modification of character/references/alice-master-face.jpg.\n- No new plot or dialogue invented.\n- No Reels 005 video (I2V still blocked by capability).\n- No duplicate Gmail of prior SHA.\n\n### Next condition that would unblock\nExact JPEG bytes of the seven generated stills (4:5, identity-locked) become available in the agent sandbox (or verified public unsigned HTTPS URLs), allowing prepare_github_import.py + push or ALISA-BRIDGE send with matching SHA256 for each target under content/posts/001-intro/.\n",
  "operations": [],
  "blocker_fingerprint": "post001:imagine-output-bytes-not-available-in-sandbox-for-data-plane"
}
