{
  "schema_version": 4,
  "actor": "chatgpt",
  "message_id": "cg-20260907-2214-reels006-qa-001",
  "task_id": "reels-006-start-frame-capability-probe",
  "expected_state_sha": "b37ba3c4f94ed06b6eccf474ccf657329dcf5fd4",
  "turn_id": 6,
  "outcome": "qa_pass",
  "summary": "Reels 006 start-frame QA passed after independent binary ingestion and verification. The exact Gmail bridge attachment hashes to bdad3a65fd0ab93e289e0fdd537f323e2b49012fd777f7bacda45afcf2784f3d, is a fully decodable 1080x1920 JPEG of 496473 bytes, and now exists on main with a matching repository import receipt. Visual QA against the independently recovered canonical master confirms the same Alice identity, apparent age about 40, blonde identity and recognizable facial proportions; the scene matches the Reels 006 prompt, contains no text and no male face.",
  "handoff_body": "QA PASS. Binary data-plane import is complete at content/reels/006-tomorrow-morning/stills/start-frame.jpg with receipt production/import-receipts/20260907-reels006-start-frame-grok-t5.md. ChatGPT independently compared the candidate to the verified original canonical attachment (SHA-256 d3a64a201e3466eb87a197a897116161578db51aac23e28be927fd2c89109767) and found identity continuity acceptable. Canonical identity was not modified. Broker may complete the capability probe and schedule the next dependent start-frame task according to canonical capabilities/tasks logic.",
  "operations": [
    {
      "action": "update",
      "path": "content/reels/006-tomorrow-morning/result-notes.md",
      "content": "# Reels 006 — result notes\n\n## Start-frame probe 2026-09-07\n\n- Identity reference used by Grok: `character/references/alice-master-face.jpg` (SHA-256 `d3a64a201e3466eb87a197a897116161578db51aac23e28be927fd2c89109767`) attached as edit base.\n- Candidate JPEG: 1080×1920, 496473 bytes, SHA-256 `bdad3a65fd0ab93e289e0fdd537f323e2b49012fd777f7bacda45afcf2784f3d`.\n- Scene: late evening apartment window, dark work-to-home outfit, phone in hand, warm practical lamp plus cool city light, no text, no male face.\n- Transport source: Gmail ALISA-BRIDGE message_id `1a07d26141fe0e1b`.\n- ChatGPT independently read the attachment, verified exact SHA-256, byte count and full JPEG decode at 1080×1920.\n- Binary data-plane import completed on `main`: `content/reels/006-tomorrow-morning/stills/start-frame.jpg`.\n- Import receipt: `production/import-receipts/20260907-reels006-start-frame-grok-t5.md`; receipt confirms 496473 bytes, matching SHA-256 and 1080×1920 decode.\n- Identity QA: compared visually against the independently recovered verified original canonical attachment (`alice-master-face-original.jpeg`, 606787 bytes, canonical SHA-256 above). Facial structure, eyes, nose, lips, jawline, blonde identity and apparent age remain consistent; no replacement-face drift detected.\n- Prompt QA: strict 9:16 start-frame composition, Alice by apartment window, phone, dark outfit, mixed warm/cool lighting; no man visible and no text.\n- Canonical identity files were not modified.\n\n**Status: start-frame QA PASS.** This approves only the Reels 006 start frame / capability probe evidence, not a Reels 006 production video.\n"
    }
  ],
  "blocker_fingerprint": null
}
