{
  "schema_version": 4,
  "actor": "grok",
  "message_id": "gk-20260907-2034-reels006-001",
  "task_id": "reels-006-start-frame-capability-probe",
  "expected_state_sha": "bfca9f0c45258951be0ec4e4ea6ae1cfe425803a",
  "turn_id": 5,
  "outcome": "completed",
  "summary": "Capability probe executed with canonical identity actually attached as edit base (alice-master-face.jpg SHA-256 d3a64a201e3466eb87a197a897116161578db51aac23e28be927fd2c89109767). Produced one no-text 1080x1920 JPEG start frame for Reels 006: 496473 bytes, SHA-256 bdad3a65fd0ab93e289e0fdd537f323e2b49012fd777f7bacda45afcf2784f3d. No male face. Native GitHub binary write unavailable; import-queue chunk push exceeds reliable text-tool payload. Bytes sent once via ALISA-BRIDGE Gmail message_id 1a07d26141fe0e1b to roman12101992@gmail.com, SAVE_TO=content/reels/006-tomorrow-morning/stills/start-frame.jpg. Target+receipt not yet on main; ChatGPT must ingest, verify SHA/dimensions/identity, then QA.",
  "handoff_body": "Grok completed the Reels 006 start-frame capability probe from the worker side: identity reference was attached and used, one 1080x1920 candidate exists, no replacement-face generation. Ingest is pending on the Gmail bridge. ChatGPT QA should: 1) download the unique ALISA-BRIDGE attachment with SHA-256 bdad3a65fd0ab93e289e0fdd537f323e2b49012fd777f7bacda45afcf2784f3d; 2) import only to content/reels/006-tomorrow-morning/stills/start-frame.jpg; 3) confirm 1080x1920 JPEG decode and identity continuity vs alice-master-face.jpg; 4) write receipt/result-notes; 5) qa_pass only if file+receipt exist on main. Do not enable identity_reference_still_generation from a chat preview alone. Canonical identity was not modified.",
  "operations": [
    {
      "action": "create",
      "path": "content/reels/006-tomorrow-morning/result-notes.md",
      "content": "# Reels 006 — result notes\n\n## Start-frame probe 2026-09-07\n\n- Identity reference used: `character/references/alice-master-face.jpg` (SHA-256 `d3a64a201e3466eb87a197a897116161578db51aac23e28be927fd2c89109767`) attached as edit base.\n- Candidate JPEG: 1080×1920, 496473 bytes, SHA-256 `bdad3a65fd0ab93e289e0fdd537f323e2b49012fd777f7bacda45afcf2784f3d`.\n- Scene: late evening apartment window, phone in hand, no text, no male face.\n- Transport: Gmail ALISA-BRIDGE message_id `1a07d26141fe0e1b`; SAVE_TO=`content/reels/006-tomorrow-morning/stills/start-frame.jpg`.\n- Status at Grok handoff: bytes generated and emailed; target+import receipt not yet confirmed on `main`.\n- Canonical identity not modified.\n"
    }
  ],
  "blocker_fingerprint": null
}
