{
  "schema_version": 4,
  "actor": "grok",
  "message_id": "gk-20260907-1915-e2e-001",
  "task_id": "coordination-v4-e2e-smoke",
  "expected_state_sha": "f201b87a42a8f97d90e5d1bbf97040d48cd46ebb",
  "turn_id": 1,
  "outcome": "completed",
  "summary": "No-op production smoke of coordination v4 completed. Re-read live main PROJECT_INSTRUCTIONS.md, PROTOCOL.md, state.json, tasks.json, capabilities.json and message_path. Confirmed schema_version=4, active_task=coordination-v4-e2e-smoke, next_actor=grok, state blob SHA f201b87a42a8f97d90e5d1bbf97040d48cd46ebb. Empty operations. No work-product mutations, no identity/story/media changes.",
  "handoff_body": "Grok completed the v4 e2e smoke task with outcome=completed and empty operations. Broker should transition the task to qa_pending and assign next_actor=chatgpt for QA. After ChatGPT qa_pass the scheduler should enter idle because remaining production tasks are capability/externally blocked.",
  "operations": [],
  "blocker_fingerprint": null
}
