{
  "schema_version": 4,
  "actor": "grok",
  "message_id": "gk-20260908-reels015-start-frame-001",
  "task_id": "reels-015-start-frame",
  "expected_state_sha": "88bd991c29319b17a0e140a456c3955f41506d4a",
  "turn_id": 17,
  "outcome": "blocked",
  "summary": "Reels 015 start-frame generation blocked: Imagine can produce the frame with identity reference in product UI, but exact output bytes are not available inside the agent sandbox for the binary data plane (prepare_github_import / Gmail attachment path). No local JPG/PNG produced that can be hashed and bridged. Canonical identity untouched. No new plot invented.",
  "handoff_body": "## Blocker\n\nOutcome: blocked\n\nFingerprint: reels015:imagine-output-bytes-not-available-in-sandbox-for-data-plane\n\n### What was attempted\n- Read state, message, tasks, prompt-grok.md, concept, storyboard, identity-lock, visual-rules, alice-profile.\n- Confirmed next_actor=grok, active_task=reels-015-start-frame, schema_version=4.\n- Canonical master face recovered locally (SHA-256 d3a64a201e3466eb87a197a897116161578db51aac23e28be927fd2c89109767) for reference readiness.\n- No autonomous path currently lands exact Imagine JPEG bytes into /home/workdir/artifacts so that production/GROK_BINARY_UPLOAD.md or GMAIL_BRIDGE can be executed with a real file + SHA-256.\n\n### Why not completed\nSame class of data-plane gap previously recorded for reels-008..013. Product can render with identity reference, but agent session does not expose the resulting binary for import-queue or ALISA-BRIDGE attachment.\n\n### What was not done\n- No generation claimed without bytes.\n- No modification of character/references/alice-master-face.jpg.\n- No new plot or dialogue invented.\n- No Reels 005 video (I2V still blocked by capability).\n- No duplicate Gmail of prior SHA.\n\n### Next condition that would unblock\nExact 1080x1920 JPEG bytes of the generated start-frame become available in the agent sandbox (or a verified public unsigned HTTPS URL), allowing prepare_github_import.py + push or ALISA-BRIDGE send with matching SHA256.\n",
  "operations": [],
  "blocker_fingerprint": "reels015:imagine-output-bytes-not-available-in-sandbox-for-data-plane"
}
