{
  "schema_version": 4,
  "actor": "chatgpt",
  "message_id": "cg-20260907-2027-e2e-001",
  "task_id": "coordination-v4-e2e-smoke",
  "expected_state_sha": "fe8164960acbc32fb7edfee40e4a8f263ceb5d02",
  "turn_id": 2,
  "outcome": "qa_pass",
  "summary": "ChatGPT QA passed the production v4 smoke. The Grok mailbox commit added exactly one proposal, Coordination v4 broker run 16 completed successfully through validation, apply and canonical commit, and live main advanced to turn_id=1, task_status=qa_pending, next_actor=chatgpt with no work-product mutation.",
  "handoff_body": "QA PASS. Broker should complete coordination-v4-e2e-smoke and run the scheduler. Because all remaining production tasks are currently capability- or external-signal-blocked, the expected canonical result is active_task=null, task_status=idle, next_actor=null, scheduler.idle_reason=no_runnable_task.",
  "operations": [],
  "blocker_fingerprint": null
}
